{
  "recommendation": "Open — unblock m365-declarative-agent-designer v0.1.0 only as an offline, user-triggered, read-only, synthetic requirements-discovery methodology. Pin the Microsoft Work IQ repository at commit 801a456d651e7e5c5e7e378baba7a195f51680dd and treat microsoft-365-agents-toolkit plugin version 1.3.1 as a candidate reference, not an approved release: the repository publishes no releases, the marketplace is Public Preview, and the upstream declarative-agent skill can provision after edits. Do not install or invoke the plugin or Microsoft 365 Agents Toolkit in v0.1.0. Reuse schemas and design guidance through a thin, deny-by-default adapter; keep Microsoft 365 app/declarative-agent/plugin artifacts, tenant validation, evaluation execution, packaging, sideloading, deployment, and publication outside this build and subject to separate organisational authorisation.",
  "production_recommendation": false,
  "evidence_label": "Open",
  "release_status": "UNKNOWN",
  "verified_date": "2026-07-21",
  "license_capacity": [
    "[U1][Confirmed] Current names: product Microsoft 365 Agents Toolkit; product repository OfficeDev/microsoft-365-agents-toolkit; upstream marketplace Microsoft Work IQ — Plugin Marketplace at microsoft/work-iq; plugin id microsoft-365-agents-toolkit.",
    "[U2][Confirmed][PUBLIC_PREVIEW] Exact candidate pin: plugin manifest version 1.3.1 at microsoft/work-iq commit 801a456d651e7e5c5e7e378baba7a195f51680dd, committed 2026-07-16. The repository has no published releases, so there is no release tag that can be called approved from public evidence.",
    "[U3][Confirmed] Official plugin client documented by microsoft/work-iq: GitHub Copilot CLI, installed with /plugin marketplace add microsoft/work-iq and /plugin install microsoft-365-agents-toolkit@work-iq. The Toolkit product separately supports Visual Studio Code, Visual Studio, and its CLI.",
    "[U4][Open] Codex is not an officially documented plugin client. A .codex-plugin/plugin.json file is structural evidence only. ChatGPT Work is not named as a supported plugin client. Microsoft 365 Copilot support for OpenAI Apps SDK based MCP apps is a different deployed-host contract and does not establish plugin support in Codex or ChatGPT Work.",
    "[U5][Confirmed] Static inventory at the pinned commit contains six skills: declarative-agent-developer; install-atk; m365-agent-evaluator; setup-sso-ui-widget; teams-app-developer; ui-widget-developer. The plugin README lists only four, omitting setup-sso-ui-widget and teams-app-developer; this documentation-to-tree mismatch is unresolved.",
    "[U6][Confirmed] Relevant capability mapping: declarative-agent-developer covers scaffold selection, instructions, manifests, capabilities/knowledge declarations, API actions, MCP plugin guidance, validation and deployment; ui-widget-developer covers MCP servers/apps and response widgets; m365-agent-evaluator covers synthetic evaluation generation plus authenticated execution; install-atk covers CLI/extension acquisition; teams-app-developer covers broader app packaging/testing/deployment; setup-sso-ui-widget covers Entra SSO, validation and sideloading.",
    "[U7][Confirmed] Upstream commands/dependencies include Node.js 18+ and npm/npx; npx -y --package @microsoft/m365agentstoolkit-cli atk; optional Visual Studio Code extension TeamsDevApp.ms-teams-vscode-extension; Toolkit commands atk doctor/new/add/auth/env/install/provision/deploy/package/validate/publish/preview; evaluation package @microsoft/m365-copilot-eval@latest. The evaluator skill raises its runtime prerequisite to Node.js 24.12.0+.",
    "[U8][Confirmed] Static inspection of public Markdown, JSON, schemas and scripts requires no Microsoft organisational authentication. Plugin installation, npx dependency acquisition, extension installation, remote schema/package retrieval, dev tunnels and hosted API/MCP debugging use the network. ATK provisioning/install/deploy/publish, connected knowledge, API/MCP runtime tests and evaluation runs cross into organisational or hosted-service execution.",
    "[U9][Confirmed] Evaluation execution requires a Microsoft 365 Copilot licence, a deployed agent, tenant-admin consent for the WorkIQ Client App, tenant configuration, and an Azure OpenAI in Foundry Models endpoint/key according to the pinned evaluator skill. None is required or authorised for synthetic evaluation-case design only.",
    "[L1][Open][UNKNOWN] Core declarative agents are current and documented, but the reviewed overview does not attach an explicit GA label. Users can use WebSearch-only agents with a Microsoft 365 subscription subject to limited capabilities; capabilities other than WebSearch require tenant metering or a Microsoft 365 Copilot licence.",
    "[L2][Confirmed] Toolkit authoring requires a Microsoft 365 subscription with sideloading enabled for target use; Azure is optional for scenarios that need hosting. Agent Builder requires a Microsoft 365 subscription. SharePoint agents require a Microsoft 365 subscription plus site-admin or owner permissions. Copilot Studio authoring requires the applicable per-user/tenant entitlement or Microsoft 365 Copilot entitlement; a trial can author/test but cannot publish.",
    "[L3][Confirmed] Copilot Studio capacity is Copilot Credits through prepaid capacity, pay-as-you-go Azure billing, or applicable Microsoft 365 Copilot zero-rating. Agent-flow/workflow actions consume capacity; design/test runs described by Microsoft are not billed, while exhausted prepaid capacity blocks new flow runs. Power Automate cloud flows retain Power Automate licensing unless one-way converted to agent flows.",
    "[L4][Confirmed] AI prompts are model-backed Power Platform assets, not declarative-agent instructions. In Copilot Studio they consume Copilot Credits; in Power Apps/Power Automate they consume prompt-builder or AI Builder capacity. Model release stages and availability vary by region; experimental and preview models must retain those labels.",
    "[L5][Open] Exact GitHub Copilot CLI entitlement for installing the Work IQ plugin is not stated in the Microsoft repository page reviewed. Confirm it independently before any future installation request.",
    "[DATES] Verification date 2026-07-21. Earliest volatile-source revalidation date 2026-08-04. Revalidate sooner if the work-iq commit/plugin version, declarative-agent schema, plugin schema, Toolkit release, Copilot Studio preview terminology, licensing, geography or national-cloud documentation changes."
  ],
  "geography_language": [
    "[G1][Confirmed] Microsoft 365 declarative-agent national-cloud overview dated 2026-06-18 says GCC has full support, GCCH supports Toolkit-built pro-code agents and Agent Builder, and DoD has limited Toolkit-only support.",
    "[G2][Open] Microsoft tool-comparison guidance dated 2026-05-08 says publishing through Microsoft 365 Agents Toolkit is not supported in Microsoft 365 Government tenants. This conflicts with G1; do not claim government-cloud fitment until Microsoft resolves the documentation or an authorised target confirms it.",
    "[G3][Confirmed] Copilot Studio is available in the US Government Community Cloud plan, but individual models, prompts, connectors, MCP, channels, new-experience features and previews have separate regional availability. No geography fitment is established for this pilot because no target cloud/region was supplied and no tenant check was authorised.",
    "[G4][Confirmed] Microsoft 365 Copilot interaction content is stored according to applicable Microsoft 365 residency commitments and user/tenant geography. Worldwide LLM processing can use other regions when capacity requires it; EU traffic stays within the EU Data Boundary, while Bing web-search queries have separate treatment.",
    "[G5][Confirmed] Copilot Studio environments and agents can be deployed by geography, but activity data powered by Microsoft 365 services can follow the end user's Exchange mailbox geography rather than the Copilot Studio environment. Processing-location review therefore belongs to the target design, not merely the source package.",
    "[G6][Confirmed] The model-driven Power Apps agent-feed experience is Preview, English-only, limited to model-driven apps, and now depends on the Power Apps MCP server for agent-feed tasks. The discontinued canvas custom-Copilot path and other Power Apps/Dynamics experiences are not portability targets for this v0.1.0 brief."
  ],
  "limitations": [
    "[A1][Confirmed] A Microsoft 365 agent is an app package. Minimum package content is manifest.json plus color.png (192x192) and outline.png (32x32); it may also contain declarative-agent, API-plugin and localisation files. Declarative agents and plugins are referenced under copilotAgents. This package is not a Power Platform solution.",
    "[A2][Confirmed] Current Microsoft 365 app manifest reference is v1.29 (updated 2026-06-29). Current declarative-agent manifest schema is v1.7 (updated 2026-05-14). Current plugin manifest schema is v2.4 (updated 2026-07-01). Generators must bind to explicit schema versions and reject unknown properties; examples on older pages must not silently downgrade those versions.",
    "[A3][Confirmed] Declarative-agent v1.7 requires version, name, description and instructions; supports capabilities, up to 12 conversation starters, 1-10 actions, behavior overrides, disclaimer, editorial answers, worker_agents and user overrides. Instructions are limited to 8,000 characters. Knowledge is declared through supported capability objects, not by hiding instructions in knowledge sources.",